{
  "schemaVersion": 1,
  "datasetId": "synthetic-scan-v3-v1",
  "classification": "TEST_ONLY",
  "cases": [
    {
      "caseId": "receipt-vnd",
      "assetId": "asset-receipt-vnd",
      "documentId": "receipt-vnd",
      "sourceGroupId": "source-receipt-vnd",
      "task": "receipt_ocr",
      "locale": "vi",
      "country": "VN",
      "quality": "clean",
      "split": "adversarial",
      "assetSha256": "9209430d5427814cb596dbfb2cd8e449fdbc5bf9b88a11992ff0980747a595d3",
      "preprocessingSha256": "37b37ec23406575e6a4a6d1ac6734611cb05ccf36bfff92667fc253c551899b1",
      "preprocessingVersion": "symbolic-v1",
      "assetKind": "SYNTHETIC_SYMBOLIC",
      "provenance": "fixture://receipt-vnd",
      "licenseReference": "MISSING",
      "permissionReference": "MISSING",
      "retentionPolicy": "TEST_ONLY_REPOSITORY",
      "accessPolicy": "PUBLIC_SYNTHETIC_ONLY",
      "redactionStatus": "SYNTHETIC_NO_PII",
      "annotation": {
        "schemaVersion": 1,
        "status": "TEST_ONLY",
        "reviewer": "MISSING",
        "adjudicator": "MISSING",
        "transcriptSha256": "MISSING",
        "providerOutputIndependent": false,
        "groundTruth": {
          "schemaVersion": 3,
          "task": "receipt_ocr",
          "document": {
            "documentId": "receipt-vnd",
            "sourceId": "source-receipt-vnd"
          },
          "items": [
            {
              "occurrenceId": "line-0",
              "sourcePosition": 0,
              "rawName": {
                "state": "known",
                "value": "Synthetic milk",
                "basis": "source_extraction",
                "evidence": [
                  {
                    "kind": "source_text",
                    "documentId": "receipt-vnd",
                    "sourcePosition": 0,
                    "text": "Synthetic milk"
                  }
                ]
              },
              "quantity": {
                "amount": {
                  "state": "known",
                  "value": 2,
                  "basis": "source_extraction",
                  "evidence": [
                    {
                      "kind": "source_text",
                      "documentId": "receipt-vnd",
                      "sourcePosition": 0,
                      "text": "2"
                    }
                  ]
                },
                "unit": {
                  "state": "known",
                  "value": "piece",
                  "basis": "source_extraction",
                  "evidence": [
                    {
                      "kind": "source_text",
                      "documentId": "receipt-vnd",
                      "sourcePosition": 0,
                      "text": "piece"
                    }
                  ]
                },
                "basis": {
                  "state": "known",
                  "value": "purchase_count",
                  "basis": "source_extraction",
                  "evidence": [
                    {
                      "kind": "source_text",
                      "documentId": "receipt-vnd",
                      "sourcePosition": 0,
                      "text": "purchase_count"
                    }
                  ]
                },
                "sourceText": {
                  "state": "known",
                  "value": "2 units",
                  "basis": "source_extraction",
                  "evidence": [
                    {
                      "kind": "source_text",
                      "documentId": "receipt-vnd",
                      "sourcePosition": 0,
                      "text": "2 units"
                    }
                  ]
                }
              },
              "canonicalId": {
                "state": "unknown",
                "reason": "unverified"
              },
              "confidence": {
                "state": "unknown",
                "reason": "not_reported"
              },
              "category": {
                "state": "unknown",
                "reason": "missing"
              },
              "storage": {
                "state": "unknown",
                "reason": "not_observable"
              },
              "unitPrice": {
                "state": "unknown",
                "reason": "missing"
              },
              "lineTotal": {
                "state": "unknown",
                "reason": "missing"
              },
              "tax": {
                "state": "unknown",
                "reason": "missing"
              },
              "discount": {
                "state": "unknown",
                "reason": "missing"
              }
            }
          ],
          "merchantName": {
            "state": "known",
            "value": "Synthetic store",
            "basis": "source_extraction",
            "evidence": [
              {
                "kind": "source_text",
                "documentId": "receipt-vnd",
                "sourcePosition": 0,
                "text": "Synthetic store"
              }
            ]
          },
          "invoiceNumber": {
            "state": "unknown",
            "reason": "missing"
          },
          "purchaseDate": {
            "state": "unknown",
            "reason": "missing"
          },
          "totalAmount": {
            "state": "known",
            "value": {
              "amountMinor": 1200,
              "currency": "VND"
            },
            "basis": "source_extraction",
            "evidence": [
              {
                "kind": "source_text",
                "documentId": "receipt-vnd",
                "sourcePosition": 0,
                "text": "{'amountMinor': 1200, 'currency': 'VND'}"
              }
            ]
          },
          "tax": {
            "state": "unknown",
            "reason": "missing"
          },
          "discount": {
            "state": "unknown",
            "reason": "missing"
          }
        }
      }
    },
    {
      "caseId": "receipt-jpy",
      "assetId": "asset-receipt-jpy",
      "documentId": "receipt-jpy",
      "sourceGroupId": "source-receipt-jpy",
      "task": "receipt_ocr",
      "locale": "ja",
      "country": "JP",
      "quality": "clean",
      "split": "adversarial",
      "assetSha256": "59a6d00082cd847a5d7e20abfb550b8a7bfc3270a15477792610d3cf7fd48b42",
      "preprocessingSha256": "7f6200690a995f92029f8b54d543f52322acfad7591aca6bacf11bc9c91d0ece",
      "preprocessingVersion": "symbolic-v1",
      "assetKind": "SYNTHETIC_SYMBOLIC",
      "provenance": "fixture://receipt-jpy",
      "licenseReference": "MISSING",
      "permissionReference": "MISSING",
      "retentionPolicy": "TEST_ONLY_REPOSITORY",
      "accessPolicy": "PUBLIC_SYNTHETIC_ONLY",
      "redactionStatus": "SYNTHETIC_NO_PII",
      "annotation": {
        "schemaVersion": 1,
        "status": "TEST_ONLY",
        "reviewer": "MISSING",
        "adjudicator": "MISSING",
        "transcriptSha256": "MISSING",
        "providerOutputIndependent": false,
        "groundTruth": {
          "schemaVersion": 3,
          "task": "receipt_ocr",
          "document": {
            "documentId": "receipt-jpy",
            "sourceId": "source-receipt-jpy"
          },
          "items": [
            {
              "occurrenceId": "line-0",
              "sourcePosition": 0,
              "rawName": {
                "state": "known",
                "value": "Synthetic milk",
                "basis": "source_extraction",
                "evidence": [
                  {
                    "kind": "source_text",
                    "documentId": "receipt-jpy",
                    "sourcePosition": 0,
                    "text": "Synthetic milk"
                  }
                ]
              },
              "quantity": {
                "amount": {
                  "state": "known",
                  "value": 2,
                  "basis": "source_extraction",
                  "evidence": [
                    {
                      "kind": "source_text",
                      "documentId": "receipt-jpy",
                      "sourcePosition": 0,
                      "text": "2"
                    }
                  ]
                },
                "unit": {
                  "state": "known",
                  "value": "piece",
                  "basis": "source_extraction",
                  "evidence": [
                    {
                      "kind": "source_text",
                      "documentId": "receipt-jpy",
                      "sourcePosition": 0,
                      "text": "piece"
                    }
                  ]
                },
                "basis": {
                  "state": "known",
                  "value": "purchase_count",
                  "basis": "source_extraction",
                  "evidence": [
                    {
                      "kind": "source_text",
                      "documentId": "receipt-jpy",
                      "sourcePosition": 0,
                      "text": "purchase_count"
                    }
                  ]
                },
                "sourceText": {
                  "state": "known",
                  "value": "2 units",
                  "basis": "source_extraction",
                  "evidence": [
                    {
                      "kind": "source_text",
                      "documentId": "receipt-jpy",
                      "sourcePosition": 0,
                      "text": "2 units"
                    }
                  ]
                }
              },
              "canonicalId": {
                "state": "unknown",
                "reason": "unverified"
              },
              "confidence": {
                "state": "unknown",
                "reason": "not_reported"
              },
              "category": {
                "state": "unknown",
                "reason": "missing"
              },